{
  "meta": {
    "title": "AI-Native Startup Operating Model evidence policy",
    "generated_at": "2026-10-03T04:49:25.989608+00:00",
    "as_of": "2026-09-25",
    "policy_version": 1,
    "requirement_count": 8,
    "maturity_counts": {
      "narrative": 2,
      "experimental": 5,
      "emerging": 1,
      "established": 0,
      "baseline": 0
    }
  },
  "purpose": "Assess startup operating requirements without allowing attention, funding, or repeated reporting to masquerade as technical or operational proof.",
  "maturity_order": [
    "narrative",
    "experimental",
    "emerging",
    "established",
    "baseline"
  ],
  "maturity_definitions": {
    "narrative": {
      "description": "A named operating idea with market or editorial attention, but insufficient technical and operational proof.",
      "recommended_posture": "Watch and investigate; do not standardize around it yet."
    },
    "experimental": {
      "description": "The pattern is technically credible and can be prototyped, but repeatable production adoption is not established.",
      "recommended_posture": "Test it in a bounded workflow with explicit success and stop conditions."
    },
    "emerging": {
      "description": "Technical evidence and independent operational use justify selective adoption, although important uncertainties remain.",
      "recommended_posture": "Adopt selectively, instrument outcomes, and preserve an exit path."
    },
    "established": {
      "description": "Repeated independent deployments show persistent technical and operational value.",
      "recommended_posture": "Make it part of the standard operating stack unless the local context provides contrary evidence."
    },
    "baseline": {
      "description": "The cost of absence is evidenced and a practical minimum implementation can be specified.",
      "recommended_posture": "Treat the minimum implementation as a default operating requirement."
    }
  },
  "dimension_rules": {
    "technical_reality": {
      "not-observed": "No qualifying technical evidence.",
      "low": "One unverified claim, prototype, paper, or artifact.",
      "moderate": "Multiple technical records or one substantial implementation with tests or benchmarks.",
      "strong": "Several independent implementations, credible benchmarks, or production-grade technical evidence without an unresolved fatal limitation."
    },
    "operational_adoption": {
      "not-observed": "No evidence of real workflow use.",
      "low": "A demo, stated intention, job posting, benchmark environment, or one vendor-reported deployment.",
      "moderate": "At least two organizations use it in real workflows, including one detailed implementation account.",
      "strong": "Repeated independent deployments show measured outcomes, persistence, and operational ownership."
    },
    "market_pull": {
      "not-observed": "No observed market activity.",
      "low": "A category is named or one product, company, or funding event appears.",
      "moderate": "Multiple independent companies, funding events, customer signals, or buying signals appear.",
      "strong": "Company formation persists alongside customer, adoption, or revenue evidence."
    },
    "evidence_independence": {
      "not-observed": "No qualifying evidence.",
      "low": "One source family or evidence concentrated around one publisher or organization.",
      "moderate": "Two or three independent evidence families with limited concentration.",
      "strong": "At least four families, including technical and operator or customer evidence, without one publisher dominating."
    }
  },
  "relationship_types": {
    "direct-support": {
      "promotion_eligible": true,
      "description": "Directly demonstrates or tests the requirement."
    },
    "supporting-context": {
      "promotion_eligible": false,
      "description": "Makes the requirement more plausible but cannot promote it alone."
    },
    "counterevidence": {
      "promotion_eligible": false,
      "description": "Contradicts the requirement or exposes an important limitation."
    },
    "discovery-only": {
      "promotion_eligible": false,
      "description": "Identifies a lead but supplies no qualifying proof."
    },
    "excluded": {
      "promotion_eligible": false,
      "description": "Irrelevant, duplicated, misclassified, or otherwise non-qualifying."
    }
  },
  "guardrails": [
    {
      "id": "no-single-score-promotion",
      "rule": "No weighted total can bypass a failed maturity gate."
    },
    {
      "id": "no-attention-as-proof",
      "rule": "Funding, mentions, engagement, newsletters, and social attention cannot prove technical reality or operational adoption."
    },
    {
      "id": "analyses-are-not-independent",
      "rule": "An analysis inherits the independence of its underlying evidence and never counts as an additional source."
    },
    {
      "id": "deduplicate-events",
      "rule": "Syndicated coverage, newsletter summaries, and repeated reporting of one launch, paper, repository, deployment, or funding round count as one event."
    },
    {
      "id": "counterevidence-cap",
      "rule": "Confidence cannot be high until counterevidence has been explicitly reviewed."
    },
    {
      "id": "concentration-cap",
      "rule": "High source concentration caps evidence independence at low and confidence at moderate."
    },
    {
      "id": "stage-is-separate",
      "rule": "Company-stage posture never changes evidence maturity; it changes only the recommended implementation."
    }
  ],
  "requirements": [
    {
      "id": "modular-agent-operating-stack",
      "title": "Modular agent operating stack",
      "requirement": "AI systems should separate models, orchestration, reusable skills, execution environments, and assurance controls into replaceable operating layers.",
      "description": "The model becomes one replaceable component inside a larger operating system for agents. The harness controls the loop, skills package repeatable actions, sandboxes constrain execution, interfaces expose progress to people, and assurance controls decide what may proceed. Separating these responsibilities makes behavior easier to test and change.",
      "what_it_looks_like": [
        "Keep model adapters separate from orchestration state and workflow control logic.",
        "Version reusable skills and tool permissions independently from prompts and model releases.",
        "Run actions in bounded environments with traces, evaluations, approval gates, and rollback."
      ],
      "applicable_to": "Startups operating multiple agent workflows or consequential agents; simple trusted scripts may not benefit from every layer.",
      "source_analysis": "early-signal-tracker/modular-agent-stack",
      "maturity": "emerging",
      "confidence": "moderate",
      "concentration": "moderate",
      "assessments": {
        "evidence_independence": "moderate",
        "market_pull": "moderate",
        "operational_adoption": "moderate",
        "technical_reality": "strong"
      },
      "rationale": "Independent technical artifacts, including a component-level harness ablation, evaluated reusable skills, permissioned MCP tools, and graph-structured skill optimization, show that orchestration, context, skills, execution, and assurance can be separated. Wood Mackenzie and Benchling remain the two detailed production deployments. Counterevidence shows that a direct API or simpler single-agent system can be cheaper and more effective when the workflow does not need a governed interoperability boundary. The requirement therefore remains emerging and conditional; stronger skill evidence does not substitute for independent operational adoption.",
      "next_gate": {
        "maturity": "established",
        "failures": [
          "operational_adoption is moderate; requires strong",
          "evidence_independence is moderate; requires strong"
        ]
      },
      "evidence_gaps": [
        "Production accounts published outside a single infrastructure vendor's channel.",
        "Comparative evidence on when modular interfaces reduce switching cost enough to offset orchestration complexity.",
        "Longer persistence showing that interfaces remain portable as models and runtimes change."
      ],
      "evidence": [
        {
          "id": "aws-machine-learning-blog:5d4f323bd0d514800a8a",
          "event_id": "wood-mackenzie-apex-platform",
          "title": "A shared agentic platform for Wood Mackenzie, on Amazon Bedrock AgentCore",
          "summary": "Wood Mackenzie built APEX, a shared agentic AI platform on Amazon Bedrock AgentCore so every team can ship production agents without rebuilding runtime, identity, observability, and guardrails from scratch. Learn why they chose AgentCore, how APEX Studio operates it, and where multi-agent systems go next.",
          "url": "https://aws.amazon.com/blogs/machine-learning/a-shared-agentic-platform-for-wood-mackenzie-on-amazon-bedrock-agentcore/",
          "published_at": "2026-09-17T15:41:03+00:00",
          "source_id": "aws-machine-learning-blog",
          "source_name": "AWS Machine Learning Blog",
          "source_type": "first-party-lab",
          "relationship": "direct-support",
          "dimensions": [
            "technical_reality",
            "operational_adoption"
          ],
          "exclusion_reason": null
        },
        {
          "id": "aws-machine-learning-blog:2335ca1a4875d9c28b23",
          "event_id": "benchling-agentcore-isolation",
          "title": "How Benchling secured multi-tenant AI agents with Amazon Bedrock AgentCore",